{
  "twinlight": "lite-1",
  "name": "小满",
  "summarizer": "Claude",
  "intro": "这是一个完全虚构的示例人物，只用来演示页面效果。",
  "themes": [
    {
      "label": "慢慢读书",
      "english": "READING SLOWLY",
      "headline": "把读过的书，变成每周一页的笔记。",
      "story": [
        "你说过自己读得不快，但坚持每周写一页读书笔记，已经半年了。",
        "比起读完多少本，你更在意哪一句话真的改变了你看事情的方式。"
      ],
      "reflection": "慢一点没关系，留下来的才算数。",
      "topics": [
        {
          "label": "每周读书笔记",
          "summary": "每周一页，记下最想留住的一句话和自己的想法。",
          "basis": "often"
        },
        {
          "label": "非虚构写作",
          "summary": "最近对把真实经历写成文章产生了兴趣，还在摸索。",
          "basis": "once"
        }
      ]
    },
    {
      "label": "动手做点小工具",
      "english": "SMALL TOOLS",
      "headline": "遇到重复的事，就想写个脚本解决它。",
      "story": [
        "你写过一个整理照片的小脚本，在自己电脑上跑通了。",
        "你会先问清楚原理，再动手，不喜欢只复制答案。"
      ],
      "reflection": "小工具省下的时间，也是你给自己的礼物。",
      "topics": [
        {
          "label": "照片整理脚本",
          "summary": "按日期自动归档照片，已经在本机运行成功。",
          "basis": "often"
        },
        {
          "label": "学习部署",
          "summary": "问过怎么把小工具放到网上，还没有真正开始。",
          "basis": "once"
        },
        {
          "label": "自动化习惯",
          "summary": "从聊天里看，你倾向把重复的事交给程序。",
          "basis": "inferred"
        }
      ]
    },
    {
      "label": "换一条路",
      "english": "A NEW PATH",
      "headline": "从设计转去教书，是你认真想过的决定。",
      "story": [
        "你提到自己离开了设计岗位，现在在做老师。",
        "你说想把过程保留下来，而不是只写一个漂亮的结果。"
      ],
      "reflection": "转弯不是重来，是带着来路继续走。",
      "topics": [
        {
          "label": "成为老师",
          "summary": "现在的工作是老师，正在适应新的节奏。",
          "basis": "often"
        },
        {
          "label": "设计经验",
          "summary": "过去做过设计，这段经历仍影响你看问题的方式。",
          "basis": "once"
        }
      ]
    }
  ],
  "card": {
    "title": "拾光者",
    "english_title": "THE LIGHT KEEPER",
    "keywords": [
      "坚持",
      "好奇",
      "动手",
      "转弯"
    ],
    "tagline": "把日常的小光，一点点收好。",
    "reflection": "你不急着证明什么，只是认真地读、认真地做、认真地换一条路。这些慢慢累积的光，就是你。",
    "art_prompt": "竖版 3:4 幻想风格角色插画。一位安静的年轻人站在夜色中的旧书店门口，手里捧着一本发光的笔记本，身边漂浮着几张写满字的纸页和一个小小的齿轮光点。冷蓝与暖金配色，柔和体积光，细腻绘本质感。画面中不要出现任何文字、边框、卡牌装饰或 SSR 字样。"
  }
}