{
  "twinlight": "lite-1",
  "name": "小满",
  "summarizer": "Claude",
  "intro": "这是一个完全虚构的示例人物，只用来演示页面效果。",
  "themes": [
    {
      "label": "主题0",
      "english": "READING SLOWLY",
      "headline": "把读过的书，变成每周一页的笔记。",
      "story": [
        "你说过自己读得不快，但坚持每周写一页读书笔记，已经半年了。",
        "比起读完多少本，你更在意哪一句话真的改变了你看事情的方式。"
      ],
      "reflection": "慢一点没关系，留下来的才算数。",
      "topics": [
        {
          "label": "每周读书笔记",
          "summary": "每周一页，记下最想留住的一句话和自己的想法。",
          "basis": "often"
        },
        {
          "label": "非虚构写作",
          "summary": "最近对把真实经历写成文章产生了兴趣，还在摸索。",
          "basis": "once"
        }
      ]
    },
    {
      "label": "主题1",
      "english": "READING SLOWLY",
      "headline": "把读过的书，变成每周一页的笔记。",
      "story": [
        "你说过自己读得不快，但坚持每周写一页读书笔记，已经半年了。",
        "比起读完多少本，你更在意哪一句话真的改变了你看事情的方式。"
      ],
      "reflection": "慢一点没关系，留下来的才算数。",
      "topics": [
        {
          "label": "每周读书笔记",
          "summary": "每周一页，记下最想留住的一句话和自己的想法。",
          "basis": "often"
        },
        {
          "label": "非虚构写作",
          "summary": "最近对把真实经历写成文章产生了兴趣，还在摸索。",
          "basis": "once"
        }
      ]
    },
    {
      "label": "主题2",
      "english": "READING SLOWLY",
      "headline": "把读过的书，变成每周一页的笔记。",
      "story": [
        "你说过自己读得不快，但坚持每周写一页读书笔记，已经半年了。",
        "比起读完多少本，你更在意哪一句话真的改变了你看事情的方式。"
      ],
      "reflection": "慢一点没关系，留下来的才算数。",
      "topics": [
        {
          "label": "每周读书笔记",
          "summary": "每周一页，记下最想留住的一句话和自己的想法。",
          "basis": "often"
        },
        {
          "label": "非虚构写作",
          "summary": "最近对把真实经历写成文章产生了兴趣，还在摸索。",
          "basis": "once"
        }
      ]
    },
    {
      "label": "主题3",
      "english": "READING SLOWLY",
      "headline": "把读过的书，变成每周一页的笔记。",
      "story": [
        "你说过自己读得不快，但坚持每周写一页读书笔记，已经半年了。",
        "比起读完多少本，你更在意哪一句话真的改变了你看事情的方式。"
      ],
      "reflection": "慢一点没关系，留下来的才算数。",
      "topics": [
        {
          "label": "每周读书笔记",
          "summary": "每周一页，记下最想留住的一句话和自己的想法。",
          "basis": "often"
        },
        {
          "label": "非虚构写作",
          "summary": "最近对把真实经历写成文章产生了兴趣，还在摸索。",
          "basis": "once"
        }
      ]
    },
    {
      "label": "主题4",
      "english": "READING SLOWLY",
      "headline": "把读过的书，变成每周一页的笔记。",
      "story": [
        "你说过自己读得不快，但坚持每周写一页读书笔记，已经半年了。",
        "比起读完多少本，你更在意哪一句话真的改变了你看事情的方式。"
      ],
      "reflection": "慢一点没关系，留下来的才算数。",
      "topics": [
        {
          "label": "每周读书笔记",
          "summary": "每周一页，记下最想留住的一句话和自己的想法。",
          "basis": "often"
        },
        {
          "label": "非虚构写作",
          "summary": "最近对把真实经历写成文章产生了兴趣，还在摸索。",
          "basis": "once"
        }
      ]
    },
    {
      "label": "主题5",
      "english": "READING SLOWLY",
      "headline": "把读过的书，变成每周一页的笔记。",
      "story": [
        "你说过自己读得不快，但坚持每周写一页读书笔记，已经半年了。",
        "比起读完多少本，你更在意哪一句话真的改变了你看事情的方式。"
      ],
      "reflection": "慢一点没关系，留下来的才算数。",
      "topics": [
        {
          "label": "每周读书笔记",
          "summary": "每周一页，记下最想留住的一句话和自己的想法。",
          "basis": "often"
        },
        {
          "label": "非虚构写作",
          "summary": "最近对把真实经历写成文章产生了兴趣，还在摸索。",
          "basis": "once"
        }
      ]
    },
    {
      "label": "主题6",
      "english": "READING SLOWLY",
      "headline": "把读过的书，变成每周一页的笔记。",
      "story": [
        "你说过自己读得不快，但坚持每周写一页读书笔记，已经半年了。",
        "比起读完多少本，你更在意哪一句话真的改变了你看事情的方式。"
      ],
      "reflection": "慢一点没关系，留下来的才算数。",
      "topics": [
        {
          "label": "每周读书笔记",
          "summary": "每周一页，记下最想留住的一句话和自己的想法。",
          "basis": "often"
        },
        {
          "label": "非虚构写作",
          "summary": "最近对把真实经历写成文章产生了兴趣，还在摸索。",
          "basis": "once"
        }
      ]
    },
    {
      "label": "主题7",
      "english": "READING SLOWLY",
      "headline": "把读过的书，变成每周一页的笔记。",
      "story": [
        "你说过自己读得不快，但坚持每周写一页读书笔记，已经半年了。",
        "比起读完多少本，你更在意哪一句话真的改变了你看事情的方式。"
      ],
      "reflection": "慢一点没关系，留下来的才算数。",
      "topics": [
        {
          "label": "每周读书笔记",
          "summary": "每周一页，记下最想留住的一句话和自己的想法。",
          "basis": "often"
        },
        {
          "label": "非虚构写作",
          "summary": "最近对把真实经历写成文章产生了兴趣，还在摸索。",
          "basis": "once"
        }
      ]
    },
    {
      "label": "主题8",
      "english": "READING SLOWLY",
      "headline": "把读过的书，变成每周一页的笔记。",
      "story": [
        "你说过自己读得不快，但坚持每周写一页读书笔记，已经半年了。",
        "比起读完多少本，你更在意哪一句话真的改变了你看事情的方式。"
      ],
      "reflection": "慢一点没关系，留下来的才算数。",
      "topics": [
        {
          "label": "每周读书笔记",
          "summary": "每周一页，记下最想留住的一句话和自己的想法。",
          "basis": "often"
        },
        {
          "label": "非虚构写作",
          "summary": "最近对把真实经历写成文章产生了兴趣，还在摸索。",
          "basis": "once"
        }
      ]
    }
  ],
  "card": {
    "title": "拾光者",
    "english_title": "THE LIGHT KEEPER",
    "keywords": [
      "坚持",
      "好奇",
      "动手",
      "转弯"
    ],
    "tagline": "把日常的小光，一点点收好。",
    "reflection": "你不急着证明什么，只是认真地读、认真地做、认真地换一条路。这些慢慢累积的光，就是你。",
    "art_prompt": "竖版 3:4 幻想风格角色插画。一位安静的年轻人站在夜色中的旧书店门口，手里捧着一本发光的笔记本，身边漂浮着几张写满字的纸页和一个小小的齿轮光点。冷蓝与暖金配色，柔和体积光，细腻绘本质感。画面中不要出现任何文字、边框、卡牌装饰或 SSR 字样。"
  }
}