{
  "twinlight": "lite-1",
  "name": "小禾 · 虚构示例",
  "summarizer": "GPT",
  "intro": "把那些慢慢照料的日常，收进一片微光。",
  "themes": [
    {
      "label": "照料日常",
      "english": "SMALL THINGS GROW",
      "headline": "每周的一点照料，让新芽有了位置。",
      "story": [
        "这份虚构记录里，小禾每周照料阳台上的植物，已经坚持了三个月。",
        "第一次画下植物观察图，让一次普通的观察留下了痕迹。"
      ],
      "reflection": "这些有限记录让我想到，你愿意为微小的变化停下来。",
      "topics": [
        {
          "label": "阳台植物",
          "summary": "连续三个月，每周照料阳台的植物。",
          "basis": "often"
        },
        {
          "label": "观察画",
          "summary": "完成了第一张植物观察图。",
          "basis": "once"
        }
      ]
    },
    {
      "label": "纸上微光",
      "english": "WORDS AT REST",
      "headline": "给书页和短句，留一点周末的时间。",
      "story": [
        "小禾在周末读一会儿书，把喜欢的短句记进小本子。"
      ],
      "reflection": "这是一次有限范围的创作性理解，并不证明专业绘画或写作能力。",
      "topics": [
        {
          "label": "阅读短记",
          "summary": "周末阅读，并记下喜欢的短句。",
          "basis": "often"
        }
      ]
    }
  ],
  "card": {
    "title": "护芽者",
    "english_title": "THE TENDER",
    "keywords": [
      "照料",
      "观察",
      "表达"
    ],
    "tagline": "为微小的生长，留一束光。",
    "reflection": "在这份虚构记录里，照料植物、画下观察和记住短句，让耐心有了具体的样子。",
    "art_prompt": "原创的苔绿色鹿形林地守护灵，柔和而细致的二维幻想插画。枝叶般的小鹿角、亚麻带挂着薄薄的植物观察册，抬起的前蹄旁有一盆嫩芽；黎明的蓝绿林地与淡金晨光，主体轮廓清晰，场景有景深。所有形象和经历均为虚构，不是任何真实用户的肖像。只有照料嫩芽这一核心隐喻，不沿用其他人的设定。"
  }
}
